{
  "attempt": 1,
  "build_id": "safehavenrr-1786865186713",
  "client_id": "safehavenrr",
  "code": "BUILD_FAILED",
  "failed_at": "2026-08-16T07:32:21.825Z",
  "input_evidence": [
    {
      "kind": "assembly",
      "logical_id": "safehavenrr-1786865186713:assembly",
      "relative_path": "assembly-manifest.json",
      "schema": "website-bot.assembly-manifest/v2",
      "sha256": "81408afdcf9f5301f56d97f4f4a2e8b33b070acff06ee1c8115933174387d697"
    }
  ],
  "message": "npm run check failed (code=1, signal=null)",
  "recoverable": false,
  "sanitized_details": {
    "stderr": "npm warn Unknown env config \"always-auth\". This will stop working in the next major version of npm. See `npm help npmrc` for supported config options.\n"
  },
  "schema": "website-bot.stage-failure/v2",
  "stage": "site-build"
}
